{
 "schema": "review-points/2",
 "mode": "points",
 "source": "review-points.md",
 "provenance": {
  "base": "e27182cbe767ce1f44c6812cda555d5b11cd653a",
  "auditedBase": "e27182cbe767ce1f44c6812cda555d5b11cd653a",
  "auditedHead": "1bcf74d4f14a165cabaaa7e9cd1cc5faaa3311b1",
  "implementation": "1bcf74d4f14a165cabaaa7e9cd1cc5faaa3311b1",
  "head": "1bcf74d4f14a165cabaaa7e9cd1cc5faaa3311b1",
  "reviewers": "4 read-only Sonnet subagents (correctness, security, ticket-fit, tests briefs)",
  "harness": "claude-code",
  "session": "82329d0a-55d2-448f-aff5-0363cf80b32f",
  "reviewCommit": "be762955d5f477feeca0f7db55e32fa1c2fb8db5"
 },
 "fixed_in": "HEAD",
 "findings": [
  {
   "title": "PUT without vetId clears the stored vet",
   "source": "correctness, security, ticket-fit and tests reviewers",
   "severity": "low",
   "observation": "A client that omits vetId wipes the existing vet; &quot;leave unchanged&quot; cannot be told from &quot;clear&quot;.",
   "why": "PUT replaces the whole visit, so clearing persists, as ticket item 2 demands. See the assumption.",
   "refs": [
    "petclinic-backend/src/main/java/victor/training/petclinic/rest/VisitRestController.java:85"
   ],
   "snippets": [
    {
     "ref": "petclinic-backend/src/main/java/victor/training/petclinic/rest/VisitRestController.java:85"
    }
   ]
  },
  {
   "title": "Unknown vetId answers a bare 404, not a 400",
   "source": "correctness, security and ticket-fit reviewers",
   "severity": "low",
   "observation": "A stale or bogus vetId fails the booking or edit with the generic &quot;Not found!&quot; 404, indistinguishable from a missing visit or pet.",
   "why": "same as unknown pet types, OwnerRestController.java:150; a 400 belongs in a codebase-wide change.",
   "refs": [
    "petclinic-backend/src/main/java/victor/training/petclinic/repository/VetRepository.java:20"
   ],
   "snippets": [
    {
     "ref": "petclinic-backend/src/main/java/victor/training/petclinic/repository/VetRepository.java:20"
    }
   ]
  },
  {
   "title": "Vet ids can be enumerated via the 404",
   "source": "security reviewer",
   "severity": "info",
   "observation": "Probing vetIds on booking reveals which vets exist.",
   "why": "GET /api/vets lists every vet already; nothing is disclosed.",
   "refs": [
    "petclinic-backend/src/main/java/victor/training/petclinic/repository/VetRepository.java:20"
   ],
   "snippets": [
    {
     "ref": "petclinic-backend/src/main/java/victor/training/petclinic/repository/VetRepository.java:20"
    }
   ]
  },
  {
   "title": "Visits expose vet names to every caller",
   "source": "security reviewer",
   "severity": "info",
   "observation": "Visit DTOs now carry the vet&#x27;s first and last name.",
   "why": "Visit endpoints are OWNER_ADMIN-only and vet names are already public via /api/vets.",
   "refs": [
    "petclinic-backend/src/main/java/victor/training/petclinic/mapper/VisitMapper.java:51-53"
   ],
   "snippets": [
    {
     "ref": "petclinic-backend/src/main/java/victor/training/petclinic/mapper/VisitMapper.java:51-53"
    }
   ]
  },
  {
   "title": "Any existing vet can be attributed to a visit",
   "source": "security reviewer",
   "severity": "info",
   "observation": "No check that the chosen vet may attend the visit.",
   "why": "choosing any vet is the feature; the ticket sets no eligibility rule.",
   "refs": [
    "petclinic-backend/src/main/java/victor/training/petclinic/rest/OwnerRestController.java:192"
   ],
   "snippets": [
    {
     "ref": "petclinic-backend/src/main/java/victor/training/petclinic/rest/OwnerRestController.java:192"
    }
   ]
  },
  {
   "title": "Chatbot create_visit cannot choose a vet",
   "source": "ticket-fit reviewer",
   "severity": "low",
   "observation": "Bookings made through the chatbot always have no vet.",
   "why": "the vet is optional at booking; owners rarely know it. Separate ticket if wanted.",
   "refs": [
    "petclinic-backend/src/main/java/victor/training/petclinic/mcp/PetClinicMcp.java:55"
   ],
   "snippets": [
    {
     "ref": "petclinic-backend/src/main/java/victor/training/petclinic/mcp/PetClinicMcp.java:55"
    }
   ]
  },
  {
   "title": "Failed vets fetch shows &quot;No vet&quot; for a visit with one",
   "source": "correctness reviewer",
   "severity": "low",
   "observation": "The error handler turns a failed GET /vets into [], so the combo finds no match and displays the placeholder.",
   "why": "model keeps the old vetId, so saving does not clear it; display-only, error path.",
   "refs": [
    "petclinic-frontend/src/app/visits/visit-edit/visit-edit.component.ts:43"
   ],
   "snippets": [
    {
     "ref": "petclinic-frontend/src/app/visits/visit-edit/visit-edit.component.ts:43"
    }
   ]
  },
  {
   "title": "Clearing the combo could send &#x27;&#x27; or 0",
   "source": "tests reviewer",
   "severity": "info",
   "observation": "The edit spec feeds onSubmit a hand-built null; if the combo emitted &#x27;&#x27; or 0 on clear, the old vet or a 404 would follow.",
   "why": "pick(&#x27;&#x27;) sets null, line 57; covered by the combo&#x27;s own spec.",
   "refs": [
    "petclinic-frontend/src/app/design-system/combo.component.ts:57"
   ],
   "snippets": [
    {
     "ref": "petclinic-frontend/src/app/design-system/combo.component.ts:57"
    }
   ]
  },
  {
   "title": "Pipe renders &quot;null null&quot; with vetId but no names",
   "source": "tests reviewer",
   "severity": "info",
   "observation": "A visit with vetId set but names missing would print &quot;null null&quot;.",
   "why": "VisitMapper.java:51-53 sets id and both names together from one entity.",
   "refs": [
    "petclinic-frontend/src/app/visits/visit-vet.pipe.ts:21"
   ],
   "snippets": [
    {
     "ref": "petclinic-frontend/src/app/visits/visit-vet.pipe.ts:21"
    }
   ]
  }
 ],
 "autofixes": [
  {
   "title": "Vet tests read the session cache, not the database",
   "source": "tests reviewer",
   "severity": "medium",
   "observation": "VisitTest is @Transactional and only one test cleared the persistence context, so create/update/clear read back the cached entity. A broken vet_id mapping or a clear that never reached the row would still pass.",
   "fix": "a flushAndClear() helper runs after every write the vet tests then assert on.",
   "refs": [
    "petclinic-backend/src/test/java/victor/training/petclinic/rest/VisitTest.java:445-448",
    "petclinic-backend/src/test/java/victor/training/petclinic/rest/VisitTest.java:268",
    "petclinic-backend/src/test/java/victor/training/petclinic/rest/VisitTest.java:397",
    "petclinic-backend/src/test/java/victor/training/petclinic/rest/VisitTest.java:407",
    "petclinic-backend/src/test/java/victor/training/petclinic/rest/VisitTest.java:419"
   ],
   "snippets": [
    {
     "ref": "petclinic-backend/src/test/java/victor/training/petclinic/rest/VisitTest.java:445-448"
    },
    {
     "ref": "petclinic-backend/src/test/java/victor/training/petclinic/rest/VisitTest.java:268"
    },
    {
     "ref": "petclinic-backend/src/test/java/victor/training/petclinic/rest/VisitTest.java:397"
    },
    {
     "ref": "petclinic-backend/src/test/java/victor/training/petclinic/rest/VisitTest.java:407"
    },
    {
     "ref": "petclinic-backend/src/test/java/victor/training/petclinic/rest/VisitTest.java:419"
    }
   ]
  },
  {
   "title": "Unknown vetId on edit and on owner-page booking untested",
   "source": "tests reviewer",
   "severity": "medium",
   "observation": "Only POST /api/visits had an unknown-vet test; PUT /api/visits/{id} and POST /owners/{o}/pets/{p}/visits could regress to a 500 unnoticed.",
   "fix": "one 404 test per path.",
   "refs": [
    "petclinic-backend/src/test/java/victor/training/petclinic/rest/VisitTest.java:380",
    "petclinic-backend/src/test/java/victor/training/petclinic/rest/VisitTest.java:351"
   ],
   "snippets": [
    {
     "ref": "petclinic-backend/src/test/java/victor/training/petclinic/rest/VisitTest.java:380"
    },
    {
     "ref": "petclinic-backend/src/test/java/victor/training/petclinic/rest/VisitTest.java:351"
    }
   ]
  },
  {
   "title": "Deleting a vet with visits is untested",
   "source": "tests reviewer",
   "severity": "medium",
   "observation": "Keeping a deleted vet&#x27;s visits rests on ON DELETE SET NULL in V4, and nothing exercised it; the delete could fail on the foreign key.",
   "fix": "test deletes a vet through the API and reads the visit back with no vet.",
   "refs": [
    "petclinic-backend/src/test/java/victor/training/petclinic/rest/VisitTest.java:429"
   ],
   "snippets": [
    {
     "ref": "petclinic-backend/src/test/java/victor/training/petclinic/rest/VisitTest.java:429"
    }
   ]
  },
  {
   "title": "Chatbot list_visits omits the vet",
   "source": "ticket-fit reviewer",
   "severity": "low",
   "observation": "The ticket says visits show their vet everywhere, yet the MCP list_visits answer had no vet field.",
   "fix": "VisitView carries vetName, null when the visit has none.",
   "refs": [
    "petclinic-backend/src/main/java/victor/training/petclinic/mcp/PetClinicMcp.java:126",
    "petclinic-backend/src/main/java/victor/training/petclinic/mcp/PetClinicMcp.java:155-158",
    "petclinic-backend/src/test/java/victor/training/petclinic/mcp/ListVisitsToolTest.java:81"
   ],
   "snippets": [
    {
     "ref": "petclinic-backend/src/main/java/victor/training/petclinic/mcp/PetClinicMcp.java:126"
    },
    {
     "ref": "petclinic-backend/src/main/java/victor/training/petclinic/mcp/PetClinicMcp.java:155-158"
    },
    {
     "ref": "petclinic-backend/src/test/java/victor/training/petclinic/mcp/ListVisitsToolTest.java:81"
    }
   ]
  }
 ],
 "assumptions": [
  {
   "title": "PUT replaces the visit; a missing vetId means no vet",
   "alternative": "PATCH-like: absent keeps the vet, explicit null clears it",
   "confidence": 0.7,